{
  "policy_id": "institutional-default",
  "version": 1,
  "title": "Institutional default compliance policy",
  "description": "Reference default for institutional Confidential Token deployments: allowlist-gated access, denylist and sanctions blocking, and jurisdiction flagging for review.",
  "rules": [
    {
      "id": "ALLOWLIST-001",
      "type": "allowlist",
      "action": "block"
    },
    {
      "id": "DENYLIST-001",
      "type": "denylist",
      "action": "block"
    },
    {
      "id": "SANCTIONS-001",
      "type": "sanctions",
      "action": "block"
    },
    {
      "id": "JURISDICTION-001",
      "type": "jurisdiction",
      "action": "flag",
      "regions": {
        "permitted": ["AU", "CA", "CH", "DE", "FR", "GB", "JP", "NL", "SG", "US"],
        "restricted": ["BY", "RU"],
        "prohibited": ["CU", "IR", "KP", "SY", "VE"]
      }
    }
  ],
  "metadata": {
    "authority": "Safeguard",
    "reference": "https://github.com/Safeguard-Inc/safeguard-policy",
    "purpose": "Reference configuration; deployments must review region lists and rule severity for their jurisdiction before use."
  }
}